{
  "$schema": "https://json-schema.org/draft/2020-12/schema",
  "$id": "https://carry.iandorsey.com/schema/carry-lesson-v1.schema.json",
  "title": "Carry Lesson Specification v1",
  "type": "object",
  "additionalProperties": false,
  "required": ["spec", "id", "subject", "section", "topic", "title", "learn", "practice"],
  "properties": {
    "$schema": { "type": "string" },
    "spec": { "const": "carry.lesson/v1" },
    "id": { "$ref": "#/$defs/identifier" },
    "subject": { "type": "string", "minLength": 1 },
    "section": { "$ref": "#/$defs/identifier" },
    "topic": { "type": "string", "minLength": 1 },
    "title": { "type": "string", "minLength": 1 },
    "objectives": {
      "type": "array",
      "minItems": 1,
      "uniqueItems": true,
      "items": { "type": "string", "minLength": 1, "pattern": "^[^<>]+$" }
    },
    "requires": {
      "type": "array",
      "minItems": 1,
      "uniqueItems": true,
      "items": { "$ref": "#/$defs/identifier" }
    },
    "teaches": {
      "type": "array",
      "minItems": 1,
      "uniqueItems": true,
      "items": { "$ref": "#/$defs/identifier" }
    },
    "registration": {
      "oneOf": [
        {
          "type": "object",
          "additionalProperties": false,
          "required": ["kind"],
          "properties": { "kind": { "const": "section" } }
        },
        {
          "type": "object",
          "additionalProperties": false,
          "required": ["kind", "key"],
          "properties": {
            "kind": { "const": "long-operation" },
            "key": { "type": "string", "minLength": 1 }
          }
        }
      ]
    },
    "learn": { "$ref": "#/$defs/learn" },
    "practice": { "$ref": "#/$defs/practice" }
  },
  "$defs": {
    "identifier": {
      "type": "string",
      "pattern": "^[a-z0-9]+(?:[.-][a-z0-9]+)*$"
    },
    "textRun": {
      "oneOf": [
        {
          "type": "object",
          "additionalProperties": false,
          "required": ["text"],
          "properties": { "text": { "type": "string", "minLength": 1, "pattern": "^[^<>]+$" } }
        },
        {
          "type": "object",
          "additionalProperties": false,
          "required": ["math"],
          "properties": { "math": { "type": "string", "minLength": 1, "pattern": "^[^<>]+$" } }
        }
      ]
    },
    "contentBlock": {
      "oneOf": [
        {
          "type": "object",
          "additionalProperties": false,
          "required": ["type", "runs"],
          "properties": {
            "type": { "const": "paragraph" },
            "runs": { "type": "array", "minItems": 1, "items": { "$ref": "#/$defs/textRun" } }
          }
        },
        {
          "type": "object",
          "additionalProperties": false,
          "required": ["type", "tex"],
          "properties": {
            "type": { "const": "math" },
            "tex": { "type": "string", "minLength": 1, "pattern": "^[^<>]+$" }
          }
        }
      ]
    },
    "learn": {
      "type": "object",
      "additionalProperties": false,
      "required": ["core"],
      "properties": {
        "figure": {
          "type": "object",
          "additionalProperties": false,
          "required": ["renderer", "id", "caption"],
          "properties": {
            "renderer": { "const": "carry" },
            "id": { "$ref": "#/$defs/identifier" },
            "caption": { "type": "string", "minLength": 1 },
            "params": {
              "type": "object",
              "additionalProperties": {
                "oneOf": [
                  { "type": "string", "minLength": 1, "pattern": "^[^<>]+$" },
                  { "type": "number" },
                  { "type": "boolean" }
                ]
              }
            }
          }
        },
        "core": { "type": "array", "minItems": 1, "items": { "$ref": "#/$defs/contentBlock" } },
        "workedExample": {
          "type": "array",
          "minItems": 1,
          "items": {
            "type": "object",
            "additionalProperties": false,
            "required": ["math", "note"],
            "properties": {
              "math": { "type": "string", "minLength": 1, "pattern": "^[^<>]+$" },
              "note": { "$ref": "#/$defs/contentBlock" }
            }
          }
        },
        "studio": { "type": "array", "items": { "$ref": "#/$defs/contentBlock" } },
        "applications": { "type": "array", "items": { "$ref": "#/$defs/contentBlock" } },
        "notice": { "type": "array", "items": { "$ref": "#/$defs/contentBlock" } },
        "workspace": { "type": "array", "items": { "$ref": "#/$defs/contentBlock" } }
      }
    },
    "response": {
      "type": "object",
      "additionalProperties": false,
      "required": ["kind", "entry", "traversal"],
      "properties": {
        "kind": { "enum": ["matrix", "digit-grid", "derivation", "transformation"] },
        "entry": { "enum": ["number", "expression"] },
        "traversal": { "enum": ["row-major", "column-major", "guided"] }
      }
    },
    "matrix": {
      "type": "array",
      "minItems": 1,
      "items": {
        "type": "array",
        "minItems": 1,
        "items": { "type": "number" }
      }
    },
    "fixedSide": {
      "type": "object",
      "additionalProperties": false,
      "required": ["kind", "math"],
      "properties": {
        "kind": { "const": "fixed" },
        "math": { "type": "string", "minLength": 1, "pattern": "^[^<>]+$" }
      }
    },
    "slotSide": {
      "type": "object",
      "additionalProperties": false,
      "required": ["kind", "response", "expected", "hint", "label"],
      "properties": {
        "kind": { "const": "slot" },
        "response": { "const": "expression" },
        "expected": { "type": "string", "minLength": 1 },
        "accepted": { "type": "array", "items": { "type": "string" } },
        "display": { "type": "string", "minLength": 1, "pattern": "^[^<>]+$" },
        "hint": { "$ref": "#/$defs/hint" },
        "misconceptions": {
          "type": "array",
          "minItems": 1,
          "items": { "$ref": "#/$defs/misconception" }
        },
        "label": { "type": "string", "minLength": 1 },
        "placeholder": { "type": "string" }
      }
    },
    "hint": {
      "oneOf": [
        { "type": "string", "minLength": 1, "pattern": "^[^<>]+$" },
        {
          "type": "object",
          "additionalProperties": false,
          "required": ["level1"],
          "properties": {
            "level1": { "type": "string", "minLength": 1, "pattern": "^[^<>]+$" },
            "level2": { "type": "string", "minLength": 1, "pattern": "^[^<>]+$" },
            "level3": { "type": "string", "minLength": 1, "pattern": "^[^<>]+$" }
          },
          "dependentRequired": { "level3": ["level2"] }
        }
      ]
    },
    "misconception": {
      "type": "object",
      "additionalProperties": false,
      "required": ["matches", "feedback"],
      "properties": {
        "matches": { "type": "string", "minLength": 1 },
        "feedback": { "type": "string", "minLength": 1, "pattern": "^[^<>]+$" }
      }
    },
    "transformation": {
      "type": "object",
      "additionalProperties": false,
      "required": ["from", "to"],
      "properties": {
        "operation": { "$ref": "#/$defs/identifier" },
        "justification": { "$ref": "#/$defs/identifier" },
        "from": { "$ref": "#/$defs/identifier" },
        "to": { "$ref": "#/$defs/identifier" }
      },
      "oneOf": [
        { "required": ["operation"], "not": { "required": ["justification"] } },
        { "required": ["justification"], "not": { "required": ["operation"] } }
      ]
    },
    "derivationRow": {
      "type": "object",
      "additionalProperties": false,
      "required": ["id", "label", "left", "relation", "right"],
      "properties": {
        "id": { "$ref": "#/$defs/identifier" },
        "label": { "type": "string", "minLength": 1 },
        "left": { "oneOf": [{ "$ref": "#/$defs/fixedSide" }, { "$ref": "#/$defs/slotSide" }] },
        "relation": { "type": "string", "minLength": 1 },
        "right": { "oneOf": [{ "$ref": "#/$defs/fixedSide" }, { "$ref": "#/$defs/slotSide" }] }
      }
    },
    "problem": {
      "type": "object",
      "additionalProperties": false,
      "required": ["id", "prompt", "givens"],
      "properties": {
        "id": { "$ref": "#/$defs/identifier" },
        "prompt": { "$ref": "#/$defs/contentBlock" },
        "difficulty": {
          "oneOf": [
            { "type": "integer", "minimum": 1, "maximum": 5 },
            { "enum": ["introductory", "developing", "challenging"] }
          ]
        },
        "transformations": {
          "type": "array",
          "minItems": 1,
          "items": { "$ref": "#/$defs/transformation" }
        },
        "givens": {
          "oneOf": [
            {
              "type": "object",
              "additionalProperties": false,
              "required": ["operation", "left", "right"],
              "properties": {
                "operation": { "enum": ["add", "subtract", "multiply"] },
                "left": { "$ref": "#/$defs/matrix" },
                "right": { "$ref": "#/$defs/matrix" }
              }
            },
            {
              "type": "object",
              "additionalProperties": false,
              "required": ["top", "bottom"],
              "properties": {
                "top": { "type": "integer", "minimum": 0, "maximum": 999 },
                "bottom": { "type": "integer", "minimum": 0, "maximum": 999 }
              }
            },
            {
              "type": "object",
              "additionalProperties": false,
              "required": ["rows"],
              "properties": {
                "rows": { "type": "array", "minItems": 1, "items": { "$ref": "#/$defs/derivationRow" } }
              }
            }
          ]
        }
      }
    },
    "practice": {
      "type": "object",
      "additionalProperties": false,
      "required": ["engine", "response", "problems"],
      "properties": {
        "engine": { "enum": ["matrix-operation", "long-addition", "guided-derivation", "equation-transform"] },
        "response": { "$ref": "#/$defs/response" },
        "problems": { "type": "array", "minItems": 1, "items": { "$ref": "#/$defs/problem" } }
      }
    }
  }
}
